topic_id,topic_label,n_speeches,Government_count,Government_terms,Opposition_count,Opposition_terms,Other_count,Other_terms
0,"assembly, national assembly, thank, national, gentlemen",67,13,"amendment, assembly, national, national assembly, day, decision, members, citizens, debate, decision amendment, monday, servants, servants national",9,"gentlemen, ladies, ladies gentlemen, going, palace, presidential, presidential palace",45,"assembly, thank, day, morning, dialogue, good, good morning, national, national assembly, new, order, order day, point, session, vote"
1,"women, violence, men, want, people",48,1,,8,"women, arabia, saudi, saudi arabia, rights, women rights, prime, alexander, alexander croo, arabia seat, commission, croo, didier, didier reynders, minister",39,"women, people, want, men, violence, law, citizens, day, hate, violence women, chamber, equality, justice, state, victims"
2,"greek, holocaust, community, years, people",43,0,,0,,43,"people, greek, holocaust, jewish, community, years, extermination, history, lost, 1945, 27, allied, auschwitz, beginning, camps"
3,"country, republic, rights, free, france",37,1,,1,,35,"country, rights, republic, day, democracy, france, free, children, freedom, french, just, let, society, territories, work"
4,"data, protection, belgium, law, does",16,0,,0,,16,"oda, data, gdpr, belgium, internet, law, protection, amazon, authority, complaint, does, european, facebook, facebook amazon, level"
5,"listen, today, say, poland, stop",11,0,,11,"poles, listen, today, listen poles, say, tell, lot, poland, poles say, want",0,
